{
  "meta": {
    "text_hash": "sha256:1c74c42e031e64a1f565994455a5b4cbce4c0c1ec37f678fcacc5ecb93388679",
    "cleaner_version": "v1.1",
    "created_at": "2026-02-24T08:00:22.893524+00:00",
    "lang": "ru",
    "length": 1342,
    "source_type": "docx"
  },
  "text": {
    "raw": "Кейс 04. Рак поджелудочной железы (C25), BRCA2+, HRD+, поддержка олапарибом Паспортная часть\nФИО: Пациентка Л., 44 года Дата рождения: 03.11.1981 Пол: женский Сопутствующие заболевания и аллергологический анамнез\nСопутствующие заболевания: Хронический панкреатит (в анамнезе).\nТромбоз глубоких вен голени (2022).\nАллергии/непереносимость: Нет данных о лекарственных аллергиях.\nДиагноз C25.0 Аденокарцинома головки поджелудочной железы, cT3N1M1 (мтс в печени), стадия IV.\nБиомаркеры и молекулярно-генетические данные (фрагменты) BRCA2: мутация (патогенный вариант, герминальная).\nHRD: положительный.\nMSI: MSS.\nPD-L1: CPS=0.\nФрагменты выписки/консультаций/протоколов (свободный текст) Анамнез: В 06.2025 - желтуха, зуд кожи, потемнение мочи.\nКТ ОБП 18.06.2025: опухоль головки ПЖ 34 мм, обструкция холедоха, мтс в печени (S7 15 мм).\nЭРХПГ 20.06.2025: стентирование желчных путей.\nЛечение: 1 линия (07-12.2025): иринотекан+оксалиплатин+5-фторурацил (FOLFIRINOX), 10 циклов.\nТоксичность: нейропатия (оксалиплатин), диарея (иринотекан).\nКонтроль 01.2026: частичный ответ.\nПоддержка (02.2026-...): олапариб 300 мг 2 раза/сут (на фоне BRCA2/HRD+).\nС 04.2026 - анемия 2 ст., временная отмена, затем возобновление с редукцией.\nСопутствующая терапия: ферменты поджелудочной железы, антикоагулянт (эноксапарин/апиксабан), препараты железа по показаниям.",
    "clean": "Кейс 04. Рак поджелудочной железы (C25), BRCA2+, HRD+, поддержка олапарибом Паспортная часть\nФИО: Пациентка Л., 44 года Дата рождения: 03.11.1981 Пол: женский Сопутствующие заболевания и аллергологический анамнез\nСопутствующие заболевания: Хронический панкреатит (в анамнезе).\nТромбоз глубоких вен голени (2022).\nАллергии/непереносимость: Нет данных о лекарственных аллергиях.\nДиагноз C25.0 Аденокарцинома головки поджелудочной железы, cT3N1M1 (мтс в печени), стадия IV.\nБиомаркеры и молекулярно-генетические данные (фрагменты) BRCA2: мутация (патогенный вариант, герминальная).\nHRD: положительный.\nMSI: MSS.\nPD-L1: CPS=0.\nФрагменты выписки/консультаций/протоколов (свободный текст) Анамнез: В 06.2025 - желтуха, зуд кожи, потемнение мочи.\nКТ ОБП 18.06.2025: опухоль головки ПЖ 34 мм, обструкция холедоха, мтс в печени (S7 15 мм).\nЭРХПГ 20.06.2025: стентирование желчных путей.\nЛечение: 1 линия (07-12.2025): иринотекан+оксалиплатин+5-фторурацил (FOLFIRINOX), 10 циклов.\nТоксичность: нейропатия (оксалиплатин), диарея (иринотекан).\nКонтроль 01.2026: частичный ответ.\nПоддержка (02.2026-...): олапариб 300 мг 2 раза/сут (на фоне BRCA2/HRD+).\nС 04.2026 - анемия 2 ст., временная отмена, затем возобновление с редукцией.\nСопутствующая терапия: ферменты поджелудочной железы, антикоагулянт (эноксапарин/апиксабан), препараты железа по показаниям."
  },
  "entities": [
    {
      "id": "e000001",
      "type": "date",
      "value": "03.11.1981",
      "norm": null,
      "span": {
        "start": 135,
        "end": 145
      },
      "context": "олапарибом Паспортная часть\nФИО: Пациентка Л., 44 года Дата рождения: 03.11.1981 Пол: женский Сопутствующие заболевания и аллергологический анамнез\nСо",
      "source": "regex:date_dmy",
      "confidence": null,
      "negated": null,
      "attrs": {}
    },
    {
      "id": "e000002",
      "type": "date",
      "value": "18.06.2025",
      "norm": null,
      "span": {
        "start": 747,
        "end": 757
      },
      "context": "екст) Анамнез: В 06.2025 - желтуха, зуд кожи, потемнение мочи.\nКТ ОБП 18.06.2025: опухоль головки ПЖ 34 мм, обструкция холедоха, мтс в печени (S7 15 м",
      "source": "regex:date_dmy",
      "confidence": null,
      "negated": null,
      "attrs": {}
    },
    {
      "id": "e000003",
      "type": "date",
      "value": "20.06.2025",
      "norm": null,
      "span": {
        "start": 837,
        "end": 847
      },
      "context": "головки ПЖ 34 мм, обструкция холедоха, мтс в печени (S7 15 мм).\nЭРХПГ 20.06.2025: стентирование желчных путей.\nЛечение: 1 линия (07-12.2025): иринотек",
      "source": "regex:date_dmy",
      "confidence": null,
      "negated": null,
      "attrs": {}
    },
    {
      "id": "e000004",
      "type": "date",
      "value": "07-12.2025",
      "norm": null,
      "span": {
        "start": 896,
        "end": 906
      },
      "context": "мм).\nЭРХПГ 20.06.2025: стентирование желчных путей.\nЛечение: 1 линия (07-12.2025): иринотекан+оксалиплатин+5-фторурацил (FOLFIRINOX), 10 циклов.\nТокси",
      "source": "regex:date_dmy",
      "confidence": null,
      "negated": null,
      "attrs": {}
    },
    {
      "id": "e000005",
      "type": "date",
      "value": "06.2025",
      "norm": null,
      "span": {
        "start": 694,
        "end": 701
      },
      "context": "рагменты выписки/консультаций/протоколов (свободный текст) Анамнез: В 06.2025 - желтуха, зуд кожи, потемнение мочи.\nКТ ОБП 18.06.2025: опухоль голо",
      "source": "regex:date_my",
      "confidence": null,
      "negated": null,
      "attrs": {}
    },
    {
      "id": "e000006",
      "type": "date",
      "value": "01.2026",
      "norm": null,
      "span": {
        "start": 1041,
        "end": 1048
      },
      "context": "Токсичность: нейропатия (оксалиплатин), диарея (иринотекан).\nКонтроль 01.2026: частичный ответ.\nПоддержка (02.2026-...): олапариб 300 мг 2 раза/сут",
      "source": "regex:date_my",
      "confidence": null,
      "negated": null,
      "attrs": {}
    },
    {
      "id": "e000007",
      "type": "date",
      "value": "02.2026",
      "norm": null,
      "span": {
        "start": 1078,
        "end": 1085
      },
      "context": "), диарея (иринотекан).\nКонтроль 01.2026: частичный ответ.\nПоддержка (02.2026-...): олапариб 300 мг 2 раза/сут (на фоне BRCA2/HRD+).\nС 04.2026 - ан",
      "source": "regex:date_my",
      "confidence": null,
      "negated": null,
      "attrs": {}
    },
    {
      "id": "e000008",
      "type": "date",
      "value": "04.2026",
      "norm": null,
      "span": {
        "start": 1143,
        "end": 1150
      },
      "context": "жка (02.2026-...): олапариб 300 мг 2 раза/сут (на фоне BRCA2/HRD+).\nС 04.2026 - анемия 2 ст., временная отмена, затем возобновление с редукцией.\nСо",
      "source": "regex:date_my",
      "confidence": null,
      "negated": null,
      "attrs": {}
    },
    {
      "id": "e000009",
      "type": "date",
      "value": "2022",
      "norm": null,
      "span": {
        "start": 306,
        "end": 310
      },
      "context": "ия: Хронический панкреатит (в анамнезе).\nТромбоз глубоких вен голени (2022).\nАллергии/непереносимость: Нет данных о лекарственных аллергиях.\nДиа",
      "source": "regex:date_y",
      "confidence": null,
      "negated": null,
      "attrs": {}
    },
    {
      "id": "e000010",
      "type": "number",
      "value": "04",
      "norm": null,
      "span": {
        "start": 5,
        "end": 7
      },
      "context": "Кейс 04. Рак поджелудочной железы (C25), BRCA2+, HRD+, поддержка олапарибом П",
      "source": "regex:number",
      "confidence": null,
      "negated": null,
      "attrs": {}
    },
    {
      "id": "e000011",
      "type": "number",
      "value": "44",
      "norm": null,
      "span": {
        "start": 112,
        "end": 114
      },
      "context": "RCA2+, HRD+, поддержка олапарибом Паспортная часть\nФИО: Пациентка Л., 44 года Дата рождения: 03.11.1981 Пол: женский Сопутствующие заболевания",
      "source": "regex:number",
      "confidence": null,
      "negated": null,
      "attrs": {}
    },
    {
      "id": "e000012",
      "type": "number",
      "value": "03.11",
      "norm": null,
      "span": {
        "start": 135,
        "end": 140
      },
      "context": "олапарибом Паспортная часть\nФИО: Пациентка Л., 44 года Дата рождения: 03.11.1981 Пол: женский Сопутствующие заболевания и аллергологический анамн",
      "source": "regex:number",
      "confidence": null,
      "negated": null,
      "attrs": {}
    },
    {
      "id": "e000013",
      "type": "number",
      "value": "1981",
      "norm": null,
      "span": {
        "start": 141,
        "end": 145
      },
      "context": "ибом Паспортная часть\nФИО: Пациентка Л., 44 года Дата рождения: 03.11.1981 Пол: женский Сопутствующие заболевания и аллергологический анамнез\nСо",
      "source": "regex:number",
      "confidence": null,
      "negated": null,
      "attrs": {}
    },
    {
      "id": "e000014",
      "type": "number",
      "value": "2022",
      "norm": null,
      "span": {
        "start": 306,
        "end": 310
      },
      "context": "ия: Хронический панкреатит (в анамнезе).\nТромбоз глубоких вен голени (2022).\nАллергии/непереносимость: Нет данных о лекарственных аллергиях.\nДиа",
      "source": "regex:number",
      "confidence": null,
      "negated": null,
      "attrs": {}
    },
    {
      "id": "e000015",
      "type": "number",
      "value": "0",
      "norm": null,
      "span": {
        "start": 389,
        "end": 390
      },
      "context": "ии/непереносимость: Нет данных о лекарственных аллергиях.\nДиагноз C25.0 Аденокарцинома головки поджелудочной железы, cT3N1M1 (мтс в печени), ",
      "source": "regex:number",
      "confidence": null,
      "negated": null,
      "attrs": {}
    },
    {
      "id": "e000016",
      "type": "number",
      "value": "0",
      "norm": null,
      "span": {
        "start": 620,
        "end": 621
      },